id,Description
81,"I am a 41-year-old female with a Master's degree and 13 years of experience as a Data Analyst. My expertise lies in collecting, processing, and analyzing large datasets to inform business decisions. I am proficient in SQL, Python, R, and Excel, as well as data visualization tools like Tableau and Power BI. My strong analytical skills and attention to detail enable me to uncover patterns and insights, while my ability to communicate findings effectively helps bridge the gap between technical and non-technical stakeholders. I am committed to continuous learning and staying updated with the latest trends in data analytics."
82,"I am a 25-year-old male working as a Sales Representative with a Bachelor's degree. My role involves interacting with clients, understanding their needs, and offering tailored solutions. Although I have no professional experience yet, I am eager to learn and grow in the sales industry. My educational background has equipped me with strong analytical and interpersonal skills, enabling me to understand market trends and connect with diverse clients. I thrive on building relationships and meeting sales targets, and I am committed to continuous learning and professional development to advance in my career."
83,"I am a 52-year-old male with a PhD and over two decades of experience in the technology sector. Currently, I hold the position of Chief Technology Officer (CTO) at my organization. My journey in the tech world began 24 years ago, and through dedication and continuous learning, I have climbed the ranks to reach this pivotal role.

As the CTO, I oversee the technological direction of the company, ensuring our strategies align with the latest advancements and industry standards. My role involves managing the IT department, collaborating with executives to drive innovation, and implementing cutting-edge solutions that enhance business operations. I am passionate about leveraging technology to solve complex problems and improve efficiency."
84,"I am a 29-year-old female Junior Designer with a Bachelor's degree, bringing two years of professional experience to my role. My background has equipped me with a strong foundation in design principles and techniques. In my current position, I assist senior designers on projects ranging from graphic to web design, collaborating with my team to develop creative concepts. I am dedicated to producing high-quality work and continuously expanding my skill set. My goal is to advance in my career, eventually moving into a senior design role where I can lead projects and mentor others."
85,"I am a 34-year-old female with a Master's degree and a decade of experience as a Financial Advisor. My expertise lies in financial planning, investment strategies, and risk management. I have worked with a diverse clientele, from young professionals to retirees, providing personalized advice tailored to their unique financial goals. I prioritize building strong, trust-based relationships and believe effective communication is key to understanding and meeting my clients' needs. I am committed to continuous learning and staying current with industry trends and regulations, ensuring I offer valuable insights and solutions to help clients achieve financial success."
86,"I am a 27-year-old Junior Account Manager with a Bachelor's degree and two years of experience in account management and client relations. In my role, I assist senior account managers by preparing reports, analyzing account performance, and ensuring clients' needs are met efficiently. I have a strong attention to detail and excel in effective communication with clients and colleagues. I am passionate about building strong client relationships and aim to advance to a senior account management position to take on more responsibility and make a greater impact within the company."
87,"I am a 40-year-old HR Generalist with 15 years of experience, holding a Bachelor's degree. My expertise spans recruitment, employee relations, performance management, and compliance with labor laws. I manage the full employee lifecycle, from hiring and onboarding to training and offboarding, fostering a positive and inclusive work environment. My skills in effective communication, empathy, and problem-solving are key to addressing employee concerns and promoting a collaborative workplace culture. I stay updated with HR trends and best practices, continuously seeking professional development to enhance my skills and better serve my organization."
88,"I am a 46-year-old Senior Project Manager with over 21 years of experience in the industry. I hold a Master's degree, which has provided me with a strong foundation in both theoretical and practical aspects of project management. In my current role, I oversee complex projects from inception to completion, ensuring they are delivered on time, within scope, and budget. My extensive experience has equipped me with the skills to manage cross-functional teams, mitigate risks, and communicate effectively with stakeholders at all levels. I am dedicated to delivering high-quality results and continuously seek opportunities to enhance my skills and knowledge."
89,"I am a 31-year-old Marketing Coordinator with a Bachelor's degree and six years of experience in the marketing field. My expertise includes developing innovative strategies to drive brand awareness and engagement. I have a strong understanding of market trends, consumer behavior, and effective communication techniques. In my role, I collaborate with cross-functional teams, manage social media accounts, create compelling content, and analyze campaign performance. I am committed to continuous learning and staying updated with the latest industry trends to bring fresh ideas to the table."
90,"I am a 36-year-old male with a PhD and currently hold the position of Principal Scientist. With over 11 years of industry experience, I have developed extensive knowledge in my field. I am passionate about research and innovation, leading cutting-edge projects, mentoring junior scientists, and collaborating with cross-functional teams. My advanced education has equipped me with the skills necessary to tackle complex problems and contribute valuable insights to my field. I am dedicated to advancing scientific knowledge and making a positive impact through my work."
91,"I am a 29-year-old female Sales Associate with a Bachelor's degree and three years of experience in the field. My expertise lies in customer service, communication, and relationship building. In my role, I engage with customers to understand their needs and provide tailored solutions, aiming to ensure a positive shopping experience that fosters loyalty and repeat business. I stay updated on industry trends and best practices to deliver the highest level of service. My strong work ethic, attention to detail, and ability to work both independently and as part of a team drive my passion for continuous improvement and professional development in sales."
92,"I am a 43-year-old male with a Bachelor's degree, currently working as a Supply Chain Manager. With 18 years of experience, I have a deep understanding of supply chain processes, logistics, and operations management. I excel in optimizing supply chain efficiency, reducing costs, and improving productivity. My responsibilities include coordinating the flow of goods, ensuring timely and budget-conscious delivery, and collaborating with various departments to streamline processes. I analyze data to forecast demand, manage inventory, and identify cost-saving opportunities. Additionally, I am dedicated to mentoring the next generation of supply chain professionals and fostering a collaborative work environment."
93,"As a Senior Marketing Manager with a Master's degree in Marketing and 25 years of industry experience, I have a proven track record of leading successful marketing campaigns and driving significant growth. My expertise spans market trends, consumer behavior, and effective marketing strategies. I oversee a talented team, fostering a collaborative and innovative environment. My leadership style emphasizes continuous learning and staying updated with the latest marketing technologies and trends. My goal is to drive marketing excellence and contribute to the overall success and growth of the company while mentoring future marketing leaders."
94,"I am a 33-year-old Business Analyst with a Bachelor's degree and seven years of experience. I specialize in analyzing business processes, identifying areas for improvement, and implementing strategic solutions to drive efficiency and growth. My role involves gathering and interpreting data to support decision-making, developing reports and presentations for stakeholders, and collaborating with cross-functional teams to ensure project success. I excel at communicating complex information clearly to both technical and non-technical audiences, and I am committed to delivering high-quality work while continuously seeking professional development opportunities."
95,"I am a 39-year-old female with a Bachelor's degree and 12 years of experience as a Training Specialist. My expertise includes assessing training needs, designing comprehensive training materials, and facilitating engaging learning sessions. I excel at creating positive learning environments and adapting methods to diverse learning styles. My goal is to empower employees with the tools and knowledge they need to excel, ultimately driving organizational success. I am committed to continuous improvement and staying updated with the latest trends in training and development."
96,"I am a 47-year-old male with a PhD, currently working as a Research Scientist. With 22 years of experience, I specialize in research methodologies, data analysis, and scientific writing. My role involves designing and conducting experiments, analyzing complex data sets, and publishing findings in reputable scientific journals. I thrive in environments that encourage curiosity and innovation, and I enjoy collaborating with fellow researchers. Additionally, I mentor junior scientists and students, helping them navigate their scientific journeys. My career is driven by a passion for discovery and a commitment to advancing knowledge in my field."
97,"I am a 26-year-old Junior Software Developer with a Bachelor's degree, providing a strong foundation in computer science and software engineering. With one year of professional experience, I assist in developing, testing, and maintaining software applications. My responsibilities include writing clean code, debugging, and collaborating with senior developers to meet project specifications. I am eager to learn and improve my skills, particularly in new programming languages, frameworks, and development methodologies. My passion for technology drives me to stay updated with the latest trends and advancements in the software development field."
98,"I am a 38-year-old Public Relations Manager with a Master's degree and a decade of experience. I specialize in managing and enhancing the public image of organizations through strategic communication plans, media relations, and social media strategies. I have successfully led numerous PR campaigns, developed strong relationships with media professionals, and effectively handled crisis communications. My creative and strategic thinking enables me to navigate complex situations and deliver impactful results. I am dedicated to continuous learning and professional growth, leveraging my expertise to contribute to the success and reputation of the organizations I work with."
99,"I am a 45-year-old Operations Analyst with a Bachelor's degree and 20 years of experience in the field. My expertise lies in optimizing processes, improving efficiency, and ensuring smooth operations. I have a keen eye for detail and a strategic mindset, which have been instrumental in driving operational success. In my current role, I analyze and improve operational processes, identify inefficiencies, and implement solutions to enhance productivity and reduce costs. My analytical skills and ability to collaborate with cross-functional teams have enabled me to deliver significant improvements in operational performance."
100,"I am a 31-year-old female Event Coordinator with a Bachelor's degree and five years of experience. My expertise lies in planning, organizing, and executing various events, including corporate conferences and social gatherings. I excel in liaising with vendors, managing budgets, coordinating logistics, and ensuring meticulous attention to detail. Passionate about creating memorable experiences, I handle multiple tasks efficiently while maintaining professionalism. Committed to continuous learning and growth, I stay updated on industry trends and innovations, making me a valuable asset to any team."
101,"I am a 35-year-old male with a Master's degree, currently working as a Product Marketing Manager with eight years of experience. My expertise lies in developing and executing marketing strategies that drive product growth and customer engagement. I collaborate with cross-functional teams to ensure our products meet market demands and exceed customer expectations. I enjoy the creative and strategic aspects of my role, from launching new products to revitalizing existing ones. My analytical skills help optimize campaign performance, and I stay updated with industry trends to bring fresh ideas to my work."
102,"I am a 49-year-old Senior HR Manager with a Master's degree in Human Resources and 19 years of experience. I specialize in employee relations, talent acquisition, performance management, and organizational development. My role involves strategizing and implementing HR policies aligned with company goals, fostering a positive work environment, and leading a team of HR professionals. I am committed to continuous learning and professional growth, staying updated on HR trends, and bringing innovative solutions to my organization. My focus is on building strong relationships and promoting a culture of inclusivity and engagement."
103,"I am a 33-year-old Junior Web Developer with a Bachelor's degree and five years of experience in the field. My work involves creating functional and visually appealing websites, and I am passionate about coding and continuously improving my technical skills. I enjoy collaborating with my team and tackling a variety of projects that challenge and enhance my abilities. In my free time, I stay updated with the latest web development trends, participate in coding challenges, and contribute to open-source projects, which helps me grow professionally and give back to the developer community."
104,"I am a 39-year-old Senior Project Coordinator with a Master's degree and 13 years of experience in project management. My expertise lies in meticulous planning, resource allocation, and ensuring project milestones are met on time and within budget. I have a keen eye for detail and excel at managing multiple tasks simultaneously. My educational background and extensive experience enable me to navigate complex projects and lead teams to success. I am committed to delivering high-quality results, staying updated with industry trends, and fostering a collaborative work environment."
105,"I am a 44-year-old male with a PhD in Data Science, currently serving as the Chief Data Officer. With 16 years of experience, I specialize in data management, analytics, and strategy. My role involves overseeing the data strategy, ensuring data quality, and fostering a data-driven culture. I collaborate with various departments to align data initiatives with business goals and lead a team of data professionals. My expertise lies in leveraging data for informed business decisions and creating value, while continuously staying updated with the latest advancements in technology and data science."
106,"I am a 30-year-old female with a Bachelor's degree, currently working as a Digital Content Producer with three years of experience. My role involves creating, editing, and managing digital content across various platforms to engage audiences and drive brand awareness. I have honed my skills in content creation, social media management, and digital marketing, developing a keen eye for detail and a deep understanding of audience engagement. I am committed to delivering high-quality content and continuously seek opportunities for professional growth and development in the digital landscape."
107,"As an IT Support Specialist with a Bachelor's degree and seven years of experience, I excel in providing technical support and troubleshooting various IT issues. My role involves assisting users with hardware and software problems, maintaining network security, and ensuring the efficient operation of computer systems. I am skilled in diagnosing and resolving technical issues, delivering excellent customer service, and staying updated with the latest technological advancements. My ability to communicate complex technical information clearly enables me to effectively assist colleagues and clients. I am committed to continuous learning and passionate about technology, always striving to improve my expertise."
108,"I am a 41-year-old Senior Marketing Analyst with a Master's degree and 14 years of experience in the marketing field. My expertise includes data analysis, market research, and developing innovative marketing strategies. I have a deep understanding of market trends, consumer behavior, and strategic planning. Throughout my career, I have led initiatives that drive brand growth and customer engagement, and I am passionate about leveraging data to inform decision-making. I take pride in mentoring junior analysts and collaborating with cross-functional teams to achieve marketing objectives, fostering a collaborative and inclusive work environment."
109,"I am a 28-year-old Customer Success Manager with a Bachelor's degree and two years of experience in the field. My role involves guiding customers through their journey with our company, ensuring they receive maximum value from our products and services. I excel at understanding customer needs, addressing concerns, and providing tailored solutions to enhance their experience. My focus is on exceeding customer expectations and fostering long-term relationships. I am passionate about continuous learning and improvement, which drives my dedication to customer success and makes me a valuable asset to any team."
110,"I am a 42-year-old Senior Graphic Designer with a Master's degree in Graphic Design and 15 years of industry experience. My expertise spans branding, advertising campaigns, digital media, and print design. I excel in various design software and continuously adapt to new technologies and trends. I pride myself on effective collaboration with clients and team members, ensuring projects meet objectives and exceed expectations. Additionally, I mentor junior designers, guiding their professional growth. My passion for design drives me to explore new trends and participate in industry events, always striving to create impactful and aesthetically pleasing designs."
111,
112,"I am a 50-year-old female with a Bachelor's degree, currently working as a Supply Chain Analyst with 22 years of experience. I specialize in supply chain management, logistics, and operations. My role involves analyzing data, optimizing processes, and ensuring efficient, cost-effective product delivery. I excel in identifying improvement areas and implementing solutions for operational excellence. I collaborate with cross-functional teams, suppliers, and stakeholders to achieve business objectives. My strong communication and problem-solving skills are key to maintaining effective relationships and ensuring seamless operations. I am committed to continuous learning and professional development to stay current with industry trends."
113,"I am a 32-year-old Senior Business Analyst with a Master's degree and six years of experience in business analysis. My expertise lies in analyzing business processes, identifying areas for improvement, and implementing data-driven solutions to enhance efficiency and productivity. I possess strong problem-solving skills, a keen eye for detail, and the ability to communicate complex ideas effectively to both technical and non-technical stakeholders. My passion for business analysis drives me to stay updated with the latest industry trends and best practices, ensuring that I bring innovative and valuable insights to my organization."
114,"As a 23-year-old Junior Marketing Analyst with a Bachelor's degree, I have six months of experience in the marketing field. In my role, I assist in analyzing market trends, developing marketing strategies, and supporting various campaigns. I thrive in the dynamic nature of marketing, balancing creativity with data-driven decisions. My work involves collaboration with different teams to achieve company goals. I am committed to continuous learning and professional development, staying updated on the latest marketing trends and networking with industry professionals. My enthusiasm and educational background drive me to make a meaningful impact in my role."
115,"I am a 31-year-old Senior Financial Analyst with a Master's degree in Finance and six years of experience. My expertise lies in financial analysis, budgeting, and forecasting. In my current role, I analyze financial data, prepare reports, and provide insights to support strategic decision-making. I collaborate with various departments to achieve financial goals and maintain a strong financial position. My analytical skills and attention to detail help identify trends and opportunities for improvement. I am committed to continuous learning and professional development, staying updated with industry trends to bring maximum value to my team and organization."
116,"As a 40-year-old professional with a Bachelor's degree, I have 15 years of experience as an Office Manager. I excel in managing office operations, coordinating administrative tasks, and leading teams to ensure efficient workflows. My role involves overseeing daily operations, managing schedules, budgeting, procurement, and maintaining office supplies. I am known for my reliability, resourcefulness, and proactive approach to improving processes and increasing efficiency. I am committed to continuous learning and fostering a positive, inclusive work environment. My goal is to enhance office performance and contribute meaningfully to my organization."
117,"I am a 48-year-old Principal Engineer with a PhD and 20 years of experience in the field. My advanced education and extensive experience have equipped me to tackle complex engineering challenges and drive innovation. I oversee significant projects, make critical decisions, and ensure our solutions meet the highest standards of quality and efficiency. I am passionate about mentoring younger engineers and fostering a collaborative, inclusive environment. My commitment to continuous learning keeps me at the forefront of technological advancements, allowing me to provide innovative solutions and make a tangible impact on my projects and team."
118,"I am a 29-year-old female working as a Junior HR Generalist with a Bachelor's degree and three years of experience in the HR field. My expertise includes recruitment, employee relations, and benefits administration. I assist with the recruitment process, onboarding new employees, and managing employee relations by building strong, empathetic relationships. Additionally, I handle benefits administration and ensure compliance with labor laws and company policies. I am committed to continuous learning and professional development, regularly attending HR workshops and seminars to stay updated on industry trends and best practices."
119,"I am a 35-year-old Senior Product Manager with a Master's degree and 10 years of experience in product management. I specialize in leading cross-functional teams to deliver innovative solutions that drive business growth. My expertise includes product lifecycle management, market analysis, and strategic planning. I have successfully managed multiple high-impact projects from concept to launch. My role requires creativity, analytical thinking, and leadership, and I thrive in dynamic environments. I work closely with stakeholders to ensure our products exceed customer expectations, leveraging effective communication and strong relationship-building skills."
120,"I am a 42-year-old female with a Bachelor's degree, currently working as a Sales Manager. With 17 years of experience in the sales industry, I have honed my skills in market dynamics, customer relationships, and strategic planning. My career is marked by consistently achieving and exceeding sales targets, driving revenue growth, and leading high-performing teams. I oversee sales operations, mentor and motivate my team, and foster a collaborative, results-driven environment. My extensive experience and educational background equip me to navigate the complexities of the sales landscape effectively, and I am committed to continuous improvement and staying updated with industry trends."
121,"I am a 53-year-old male with a Master's degree and over 25 years of experience in the marketing industry. As the Director of Marketing, I leverage my extensive background to drive growth and innovation. I have a deep understanding of market trends, consumer behavior, and communication strategies, which has led to successful campaigns and significant revenue growth. I oversee all marketing activities, working closely with cross-functional teams to align strategies with business objectives. My leadership style is collaborative, and I am passionate about mentoring the next generation of marketing professionals. I stay active in my community and continuously engage with industry trends."
