id,Description
284,"I am a Senior Financial Manager with a Bachelor's degree and nine years of experience in the financial sector. My expertise lies in financial management, strategic planning, and risk assessment. I oversee financial operations, develop budgets, and implement strategies to drive organizational growth. I collaborate with various departments to ensure financial stability and efficiency, providing insights based on thorough analysis and forecasting. Committed to continuous learning, I stay updated with industry trends and best practices, enhancing my technical skills and leadership abilities. My passion for my work drives me to contribute to my company's success."
285,"I am a Senior Product Designer with a PhD and 15 years of experience in product design. My expertise lies in driving innovation and creating user-centric products. I have a deep understanding of design principles, user experience, and market trends. My role involves designing and refining products, collaborating with cross-functional teams, and ensuring solutions meet user needs and business goals. My advanced research skills and design theory knowledge, combined with hands-on experience, allow me to develop innovative solutions. I am committed to lifelong learning and staying updated with the latest advancements in design and technology."
286,"I am a 33-year-old Junior Business Analyst with a Bachelor's degree and four years of experience in business analysis. My role involves gathering and analyzing data to support informed business decisions. I have a keen eye for detail and a strong analytical mindset, working collaboratively with cross-functional teams to identify needs, develop solutions, and implement changes that enhance efficiency and productivity. I am passionate about continuous learning and professional growth to advance my career in business analysis."
287,"As a 35-year-old Senior Marketing Analyst with a Bachelor's degree and eight years of experience, I specialize in data analysis, strategic planning, and campaign management. My expertise lies in analyzing market trends, consumer behavior, and campaign performance to develop data-driven strategies that drive business growth. I thrive in dynamic environments, leveraging my analytical mindset and attention to detail to identify key insights and opportunities. Collaboration is essential to me, and I work closely with cross-functional teams to align marketing initiatives with business objectives. My commitment to continuous learning ensures I stay updated on the latest marketing trends and technologies."
288,"I am a 44-year-old Senior Software Engineer with a Bachelor's degree in Computer Science and 13 years of experience in the tech industry. My expertise includes software development, project management, and team leadership. I excel in designing and implementing robust software systems, optimizing performance, and ensuring high code quality. In my current role, I lead a team of developers, mentor junior engineers, and collaborate with cross-functional teams to deliver high-quality software products. I am committed to continuous learning and staying updated with the latest industry trends and technologies."
289,"I am a 32-year-old Junior Product Manager with a Bachelor's degree and four years of experience in the field. In my role, I assist in the development and management of products from conception to launch, collaborating with cross-functional teams such as engineering, design, marketing, and sales. My focus is on creating products that solve real problems and enhance user experiences. I am committed to continuous learning, staying updated with the latest trends and best practices in product management, and actively participating in industry-related events and workshops."
290,"I am a 38-year-old Senior Business Analyst with a Bachelor's degree and a decade of experience in the field. My expertise lies in analyzing business processes, identifying opportunities for improvement, and implementing strategic solutions to drive organizational success. I collaborate with cross-functional teams to gather requirements, conduct data analysis, and provide actionable insights that support decision-making processes. I excel at translating complex data into clear, concise reports for stakeholders. My strong communication skills and team-oriented approach help foster a positive work environment, and I am committed to continuous improvement and delivering high-quality results."
291,"As a 49-year-old male with a PhD and 21 years of experience, I serve as the Director of Operations. My expertise lies in managing complex operations, streamlining processes, and leading diverse teams to achieve organizational goals. I am passionate about optimizing operational efficiency and driving strategic initiatives. My role involves overseeing daily operations, ensuring smooth and efficient processes, and aligning strategies with company objectives. My leadership style is collaborative and inclusive, fostering a culture of continuous improvement. I am dedicated to mentoring and developing future leaders while staying current with industry trends and advancements."
292,"As a 29-year-old Junior Marketing Specialist with a Bachelor's degree, I have two years of experience in the marketing field. My role involves assisting in the development and execution of marketing campaigns, conducting market research, and analyzing data to measure strategy effectiveness. I thrive on collaborating with my team to create innovative solutions that enhance brand awareness and customer engagement. I am dedicated to staying current with the latest marketing trends and technologies, continually improving my skills to ensure our marketing efforts are both effective and cutting-edge."
293,"As a 35-year-old Senior Business Development Manager with a Bachelor's degree in Business Administration, I bring seven years of experience in identifying new business opportunities, building client relationships, and driving revenue growth. I excel in dynamic environments, leading a team to set and achieve strategic goals. My strong communication and negotiation skills have secured high-value contracts and partnerships. I am committed to continuous learning, regularly attending industry conferences and workshops to stay updated with market trends. My ultimate goal is to contribute to my organization's long-term success while advancing my career in business development."
294,"I am a 45-year-old woman with a Master's degree in Human Resources Management and 14 years of experience in the field. As a Senior HR Manager, I oversee the HR department, implement strategic HR initiatives, and ensure our company attracts, develops, and retains top talent. I have a deep understanding of HR practices, employee relations, and organizational development. My strengths include navigating complex employee issues, developing effective training programs, and leading successful recruitment efforts. I am passionate about fostering a positive work environment and promoting a culture of continuous improvement."
295,"I am a 33-year-old male working as a Junior Financial Analyst with a Bachelor's degree. Over the past four years, I've developed expertise in data analysis, financial modeling, and market research. My role involves assisting senior analysts in evaluating financial data, preparing reports, and providing insights for investment decisions. I possess a keen eye for detail and a strong analytical mindset, which have been honed through my academic background and professional experience. I am dedicated to continuous learning and staying updated with the latest industry trends to advance in the field of financial analysis."
296,"As a 40-year-old Senior Marketing Manager with a Bachelor's degree and over 12 years of experience, I specialize in strategic planning, brand management, and digital marketing. My role involves overseeing marketing strategies, managing budgets, and ensuring our brand's message resonates with the target audience. I excel in analyzing market trends, understanding consumer behavior, and developing innovative solutions that drive business growth. Passionate about mentoring, I strive to create an inclusive work environment. I stay updated with the latest marketing trends, attend industry conferences, and network with fellow professionals to continuously improve my skills and embrace new challenges."
297,"I am a 44-year-old Senior Data Scientist with a PhD in Computer Science and 16 years of experience. My expertise lies in data analysis, machine learning, and statistical modeling. I have led complex projects, collaborated with cross-functional teams, and mentored junior data scientists. My role involves designing predictive models, analyzing large datasets, and presenting findings to stakeholders. I excel at translating technical concepts for non-technical audiences. Committed to continuous learning, I stay updated with industry advancements and contribute to academic research. I value effective communication, teamwork, and leadership, fostering a collaborative environment to drive innovation."
298,"I am a 30-year-old female currently working as a Junior Operations Coordinator with a Bachelor's degree and two years of experience. In my role, I coordinate and streamline processes to ensure smooth and efficient operations within the company. I collaborate with various departments to identify areas for improvement and implement strategies that enhance productivity and reduce costs. My attention to detail and strong organizational skills enable me to manage multiple tasks and projects simultaneously. I am committed to continuous learning and professional growth, with a goal to advance in my career and take on more significant responsibilities."
299,"I am a 37-year-old Senior Marketing Analyst with a Bachelor's degree and nine years of experience in the marketing field. My expertise lies in data analysis, market research, and strategic planning. I excel at analyzing market trends, consumer behavior, and competitive landscapes to develop actionable insights that drive business growth. I am skilled at translating complex data into clear, strategic recommendations. I stay updated with the latest marketing tools and techniques, ensuring innovative and effective strategies. Collaboration and communication are key aspects of my role, and I enjoy working with cross-functional teams to achieve common goals."
300,"I am a 48-year-old female with a Master's degree, currently serving as the Director of Human Resources. With 20 years of experience in HR, I specialize in talent acquisition, employee relations, and organizational development. My role involves strategic planning, policy development, and ensuring compliance with labor laws. I am passionate about fostering a culture of inclusivity and continuous improvement. Leading a team of HR professionals, I emphasize mentorship, open communication, and collaborative leadership. My extensive experience enables me to navigate complex situations and implement effective solutions that benefit both employees and the organization."
301,"I am a 31-year-old Junior Project Manager with a Bachelor's degree and three years of experience in project management. My role involves overseeing project development from initial planning to final execution, coordinating teams, managing timelines, and ensuring successful project completion. I excel in effective communication and resource management, which have been key to my success. I am passionate about project management and continuously seek opportunities to learn and improve. My dedication, education, and experience make me a valuable asset to any team."
302,"I am a 38-year-old Senior Operations Coordinator with a Bachelor's degree and nine years of experience. I specialize in managing and optimizing operational processes to ensure efficiency and effectiveness within the organization. My role involves coordinating logistics, supply chain management, process improvement, and team leadership. I have a keen eye for detail and a strategic mindset, enabling me to identify areas for improvement and implement solutions that drive productivity and cost savings. I thrive in dynamic environments, leveraging my expertise to streamline operations and support the company's overall goals."
303,"I am a Senior Data Engineer with a PhD in Computer Science and 16 years of experience in the tech industry. My expertise lies in data architecture, big data technologies, and advanced analytics. I specialize in designing and implementing scalable data solutions, collaborating with cross-functional teams to ensure robust and efficient data systems aligned with business goals. I excel at translating complex technical concepts into actionable insights, driving decision-making processes. My strong problem-solving abilities and commitment to continuous learning have been key to my success. I also enjoy mentoring junior engineers and staying current with industry trends."
304,"I am a 33-year-old female currently working as a Junior Marketing Manager with a Bachelor's degree. Over the past five years, I have gained experience in digital marketing, content creation, and campaign management. In my role, I develop and execute marketing plans aligned with company goals, collaborating with cross-functional teams to ensure effective initiatives. My work involves both creativity and analytical thinking, crafting compelling messages and analyzing data to measure campaign success. I stay updated with the latest marketing trends and technologies to bring fresh ideas to the table, continuously learning and growing in my career."
305,"I am a 36-year-old Senior Business Analyst with a Bachelor's degree and eight years of experience. My expertise lies in data analysis, strategic planning, and project management. In my current role, I analyze complex business data to identify trends and opportunities, working closely with cross-functional teams to develop and implement strategies that drive organizational success. My ability to translate data insights into actionable recommendations has been crucial in achieving business goals. I am committed to continuous learning and staying updated with industry trends, which, combined with my analytical mindset and strong communication skills, allows me to effectively convey complex information to stakeholders."
306,"As a 49-year-old female with a Master's degree in Marketing, I serve as the Director of Marketing with 21 years of experience. My expertise lies in strategic planning, brand management, and market analysis, driving successful campaigns that significantly contribute to organizational growth. I lead a talented team with a collaborative and inclusive approach, fostering creativity and innovation. Passionate about mentoring young talent, I stay updated with the latest marketing trends and technologies to ensure our strategies remain effective. My dedication to marketing is driven by the challenge of finding innovative solutions and achieving measurable results."
307,"I am a 31-year-old Junior Operations Analyst with a Bachelor's degree and three years of experience in operations analysis. In my role, I analyze and improve operational processes by collecting and interpreting data, identifying inefficiencies, and recommending solutions to enhance productivity. I excel in approaching problems analytically and developing practical strategies that drive positive outcomes. I am committed to continuous learning and professional development, and I am a strong communicator and team player. I enjoy collaborating with colleagues across departments to achieve common goals and contribute effectively to the organization."
308,"I am a 42-year-old Senior Project Manager with a Bachelor's degree and 12 years of experience. I specialize in managing complex projects and leading diverse teams to success. My expertise includes overseeing project lifecycles, ensuring objectives are met on time and within budget, and fostering a collaborative environment. I excel in navigating challenges, mitigating risks, and mentoring junior team members. My leadership style is inclusive and supportive, and I am dedicated to continuous learning and professional growth. My passion lies in delivering results that exceed expectations and making a meaningful impact through my work."
309,"I am a 47-year-old male with a Master's degree in Marketing and 19 years of experience in the field. As the Director of Marketing, I lead the marketing department, develop comprehensive strategies, and ensure our campaigns align with company goals. My expertise includes understanding market trends, consumer behavior, and strategic planning. I am passionate about leveraging data-driven insights to optimize marketing initiatives and drive growth. I also prioritize mentoring my team and fostering a collaborative environment. My extensive experience and educational background equip me to navigate the evolving landscape of marketing effectively."
310,"I am a Junior Business Development Associate with a Bachelor's degree and 1.5 years of experience. In my role, I identify new business opportunities, build relationships with potential clients, and support the senior team in executing strategic initiatives. My analytical skills and passion for fostering growth and innovation drive my contributions to the company. I am dedicated, eager to learn, and continuously seek opportunities to expand my knowledge and expertise in the business development field."
311,"I am a 35-year-old Senior Financial Manager with a Bachelor's degree in Finance and nine years of experience in the financial sector. My expertise includes financial analysis, strategic planning, and team leadership. I excel in overseeing financial operations, managing budgets, and ensuring regulatory compliance. My strong analytical skills and strategic mindset have been key in optimizing financial performance and achieving organizational goals. I am committed to continuous learning and staying updated with industry trends to bring effective strategies to my role."
312,"As a 44-year-old Senior Product Designer with a PhD and 15 years of experience, I specialize in creating innovative, user-centric designs that drive product success. My expertise lies in blending aesthetics with functionality to ensure exceptional user experiences. I have worked on a diverse range of projects, from conceptualizing new products to refining existing ones, and thrive in collaborative environments. My deep understanding of design principles, user research, and industry trends allows me to solve complex design challenges effectively. I am passionate about continuous learning and mentoring the next generation of designers."
313,"I am a 33-year-old Junior Business Analyst with a Bachelor's degree and four years of experience. In my role, I analyze business data, identify trends, and provide actionable insights to support strategic decisions. I am skilled in data analysis, problem-solving, and communication, and I am dedicated to contributing to my team's success. I am passionate about continuous learning and growth, always seeking opportunities to enhance my expertise and advance my career in business analysis."
314,"As a 35-year-old Senior Marketing Analyst with a Bachelor's degree and eight years of experience, I specialize in developing and implementing marketing strategies to drive brand awareness and customer engagement. My role involves analyzing market trends, consumer behavior, and competitive landscapes to identify growth opportunities. I excel in creating data-driven marketing campaigns and collaborating with cross-functional teams to align marketing efforts with business objectives. My passion for staying updated with the latest industry trends and technologies fuels my ability to innovate and adapt. Additionally, I am dedicated to mentoring emerging marketing professionals and maintaining a healthy work-life balance."
315,"I am a Senior Software Engineer with 13 years of experience, holding a Bachelor's degree. My role involves designing, developing, and maintaining complex software systems while collaborating with cross-functional teams to ensure high-quality deliverables. I mentor junior engineers and stay updated with the latest industry advancements. My technical expertise is complemented by strong problem-solving abilities and effective communication skills, enabling me to work efficiently with both technical and non-technical stakeholders. Passionate about continuous learning, I am dedicated to improving development processes and delivering exceptional results."
316,"As a 34-year-old Senior Financial Advisor with a Master's degree in Finance, I have six years of experience in financial planning, investment strategies, and wealth management. In my role, I provide comprehensive financial advice to a diverse portfolio of clients, creating personalized financial plans, advising on investment opportunities, and helping clients achieve their financial goals. My strong analytical skills and attention to detail are crucial in assessing risks and identifying profitable investment options. I am committed to continuous learning and professional growth, staying updated with the latest financial news and trends to offer the best advice to my clients."
317,"As a 36-year-old Senior Marketing Specialist with a Bachelor's degree and eight years of experience, I excel in creating and executing marketing strategies that drive business growth and enhance brand visibility. My expertise includes analyzing market data, understanding consumer behavior, and leveraging digital marketing techniques. I have successfully managed diverse projects, from product launches to comprehensive campaigns, collaborating with cross-functional teams to achieve our goals. My strong analytical abilities and creative thinking have consistently resulted in successful campaigns. I am passionate about staying updated with industry trends and mentoring junior team members to foster a collaborative work environment."
318,"I am a 30-year-old female currently working as a Junior HR Coordinator with a Bachelor's degree and two years of experience. My role involves supporting the HR department in recruitment, employee relations, and administrative tasks. I assist with job postings, interview coordination, onboarding, maintaining employee records, managing benefits, and ensuring compliance with company policies and labor laws. I am passionate about fostering a positive work environment, addressing employee concerns, and organizing team-building activities. I am dedicated to continuous learning and professional development, aiming to advance within the HR field and make a significant impact on the organization."
319,"As a 37-year-old Senior Business Development Manager with a Bachelor's degree and 10 years of experience, I specialize in identifying new business opportunities, building strong client relationships, and developing strategies to enhance market presence. My expertise includes analyzing market trends, negotiating deals, and collaborating with cross-functional teams. I am committed to continuous learning and staying ahead of industry trends to ensure competitiveness and innovation. My passion for business development drives me to contribute to the growth and success of my organization."
320,"As a 45-year-old Senior Marketing Manager with a Master's degree in Marketing and 16 years of experience, I excel in leading marketing strategies and campaigns that drive business growth and brand recognition. My expertise spans digital marketing initiatives and large-scale product launches, with a deep understanding of market trends, consumer behavior, and the latest marketing technologies. I am passionate about creating innovative marketing solutions and mentoring junior team members. My commitment to high-quality work and continuous professional development ensures I stay competitive in the ever-evolving marketing landscape."
321,"I am a 32-year-old Junior Financial Advisor with a Bachelor's degree and four years of experience in the financial industry. My expertise includes investment strategies, financial planning, and client relations. I am dedicated to helping clients achieve their financial goals through personalized advice and support, focusing on retirement planning, investment management, and budgeting. I prioritize building long-term relationships based on trust and transparency. I stay updated with market trends and financial regulations and am pursuing additional certifications to further my career."
322,"As a 39-year-old Senior Project Manager with a Bachelor's degree and 12 years of experience, I excel in overseeing complex projects to ensure timely and budget-compliant completion. My career has equipped me with a strategic mindset and a keen eye for detail, allowing me to successfully manage resources, coordinate with stakeholders, and mitigate risks. I am passionate about leading teams, fostering collaboration, and driving projects to successful outcomes. My diverse project experience across various industries has enhanced my adaptability and broadened my perspective, and I am committed to continuous learning and professional development."
323,"I am a 47-year-old male with a PhD, currently serving as the Director of Engineering. With 20 years of experience in the field, I have honed my skills and expertise to lead engineering teams effectively. My journey has been marked by a relentless pursuit of innovation and excellence. Throughout my career, I have been dedicated to fostering a collaborative environment where creativity and technical prowess can thrive. My extensive background has equipped me with the knowledge and leadership capabilities to drive projects to successful completion, ensuring that both the team and the organization achieve their goals."
