id,Description
164,"I am a 41-year-old Senior Human Resources Manager with a Master's degree and 13 years of experience in HR. My expertise includes talent acquisition, employee relations, performance management, and organizational development. I am passionate about creating positive work environments and fostering a culture of inclusivity and engagement. My role involves developing and implementing HR strategies, overseeing recruitment, designing training programs, managing employee benefits, and ensuring compliance with labor laws. I am committed to continuous learning and building strong relationships with employees to help them achieve their career goals."
165,"I am a 27-year-old Junior Business Development Associate with a Bachelor's degree and 1.5 years of experience. In my role, I identify new business opportunities, build relationships with potential clients, and support the senior team in executing strategic initiatives. My work allows me to leverage my analytical skills and passion for connecting with people. Eager to learn and grow, I am committed to advancing my career by continuously improving my skills and taking on new challenges in the business development field."
166,"I am a 40-year-old female Senior Account Manager with a Bachelor's degree and 14 years of experience. My role involves overseeing client accounts, developing strategic plans, and ensuring top-notch service delivery. I excel in analytical thinking, effective communication, and managing multiple projects simultaneously. Building and maintaining strong client relationships is a key aspect of my job, and I thrive in a dynamic environment that encourages innovation. Outside of work, I am dedicated to lifelong learning and balancing my professional and personal life."
167,"I am a 46-year-old male with a PhD, currently serving as a Senior Researcher with 18 years of experience. My expertise lies in conducting high-level research, leading projects, and publishing findings in reputable journals. I also mentor junior researchers, fostering a collaborative and intellectually stimulating environment. My work is driven by a passion for discovery and innovation, and I am committed to staying abreast of the latest advancements in my field. I strive to maintain a healthy work-life balance to ensure overall effectiveness and satisfaction in my role."
168,"I am a 31-year-old female with a Bachelor's degree, currently working as a Junior HR Coordinator. With four years of experience in the HR field, I have developed a strong understanding of various HR functions and best practices. My responsibilities include assisting with recruitment, onboarding, employee relations, and benefits administration. I work closely with both employees and management to ensure a positive and productive work environment. My attention to detail and excellent communication skills have been key in managing these responsibilities effectively. I am passionate about fostering a supportive and inclusive workplace culture and am dedicated to furthering my professional development in human resources."
169,"I am a 34-year-old Senior Software Engineer with a Master's degree in Computer Science and nine years of experience in software development. I specialize in designing, developing, and maintaining complex software systems, collaborating with cross-functional teams to ensure high-quality and high-performance products. My expertise includes a deep understanding of software architecture, coding best practices, and the latest industry trends. I am proficient in multiple programming languages and frameworks, allowing me to adapt quickly to new challenges. I thrive in dynamic environments, enjoy solving complex problems, and am passionate about mentoring junior developers and fostering a collaborative work environment."
170,"I am a 50-year-old professional with a Master's degree in Finance and over 20 years of experience. As the Director of Finance, I oversee financial operations, develop long-term strategies, and ensure regulatory compliance. My expertise lies in financial management, strategic planning, and organizational leadership. Throughout my career, I have led diverse teams and projects, significantly contributing to organizational growth and stability. I am passionate about driving financial performance and supporting my company's mission. Additionally, I am dedicated to mentoring the next generation of finance professionals and staying updated with industry advancements."
171,"I am a 29-year-old Junior Marketing Coordinator with a Bachelor's degree and two years of experience in the marketing field. I have developed a solid foundation in various marketing strategies and tactics. My role involves assisting in the planning and execution of marketing campaigns, conducting market research, and analyzing data to improve our marketing efforts. I am passionate about creative problem-solving and enjoy working in a dynamic environment where I can contribute to the growth and success of the company. I am dedicated to honing my skills and advancing my career while making a positive impact on the projects I am involved in."
172,"As an employee, I bring a wealth of diverse experiences and a commitment to excellence in my professional endeavors. My journey has been shaped by a variety of roles and responsibilities, each contributing to my growth and expertise. I am dedicated to continuous learning and development, always seeking opportunities to enhance my skills and knowledge. My approach to work is characterized by a strong work ethic, attention to detail, and a passion for achieving results. I believe in the power of collaboration and communication, and I am always eager to contribute to a positive and productive work environment."
173,"I am a Senior Project Manager with a Bachelor's degree and 16 years of experience in the field. My expertise lies in leading complex projects to successful completion, coordinating cross-functional teams, managing budgets, and ensuring alignment with organizational objectives. I excel in strategic planning, problem-solving, and effective communication. My career has been marked by a series of successful projects that have exceeded stakeholder expectations. I thrive in dynamic environments and am committed to continuous learning and professional development, staying current with industry trends to bring innovative ideas to my projects."
174,"I am a 26-year-old female Junior Data Scientist with a Master's degree, bringing 1.5 years of experience in data analysis, machine learning, and statistical modeling. In my current role, I analyze large datasets, build predictive models, and create data visualizations to support decision-making processes. I collaborate with cross-functional teams to deliver actionable insights that drive business growth. Passionate about continuous learning, I stay updated with the latest advancements in data science and technology, and I enjoy working on personal projects to apply new knowledge and skills."
175,"As a 35-year-old Senior Operations Analyst with a Bachelor's degree and seven years of experience, I specialize in analyzing and improving operational processes to boost efficiency and productivity. My expertise lies in data analysis and process optimization, allowing me to identify areas for improvement and implement effective solutions. I excel in collaborating with cross-functional teams and communicating complex information clearly. My analytical mindset and attention to detail have been crucial in delivering high-quality results. I am committed to continuous learning and professional development to stay current with industry trends and best practices."
176,"With a PhD and 18 years of experience in the marketing industry, I serve as a Senior Marketing Manager. My expertise lies in strategic planning, brand management, and digital marketing. I have successfully led diverse teams and numerous campaigns, leveraging my strong foundation in research and analytical skills to develop data-driven marketing strategies. I am passionate about staying ahead of industry trends and utilizing new technologies to drive business growth. My role involves overseeing marketing initiatives, managing budgets, and collaborating with cross-functional teams to achieve organizational goals, while also mentoring junior team members."
177,
178,"I am a 38-year-old Senior Human Resources Coordinator with a Bachelor's degree and 10 years of experience in the field. My expertise includes recruitment, employee relations, performance management, and ensuring compliance with labor laws. I excel in fostering positive work environments and supporting both employees and organizational goals. My commitment to high-quality HR services and continuous improvement drives my success. I stay updated with the latest HR trends and best practices, and I am passionate about helping others and navigating complex situations effectively."
179,"I am a 46-year-old male with a Master's degree and 20 years of experience in operations management. Currently, I serve as the Director of Operations, where I focus on optimizing processes to ensure efficiency and effectiveness. My extensive background has equipped me with a deep understanding of operational complexities. I am passionate about driving strategic initiatives, implementing best practices, and leading teams to achieve organizational goals. I oversee various departments, coordinate cross-functional activities, and ensure alignment with the company's vision. My commitment to lifelong learning and staying updated with industry trends helps me maintain a competitive edge in the field."
180,"I am a 29-year-old Junior Sales Representative with a Bachelor's degree and two years of experience in the sales industry. My role involves identifying potential clients, building relationships, and closing sales to meet company targets. I excel in dynamic environments and enjoy finding innovative solutions to meet clients' needs. My goal is to provide exceptional service and support, ensuring customer satisfaction and loyalty. I am passionate about sales, continuously seeking opportunities for professional growth and development."
181,"I am a 37-year-old Senior Business Analyst with a Master's degree in Business Administration and nine years of experience in the field. My expertise lies in data analysis, strategic planning, and business process improvement. I have a proven track record of collaborating with cross-functional teams to identify business needs, analyze data, and develop actionable recommendations. My ability to translate complex data into clear, concise reports supports informed decision-making at all organizational levels. My advanced education and hands-on experience enable me to deliver innovative and effective solutions, driving business success. I am committed to continuous learning and professional development."
182,"I am a 44-year-old female with a PhD and 15 years of experience as a Senior UX Designer. My expertise lies in user experience design, focusing on creating functional, intuitive, and enjoyable digital products. My advanced education in human-computer interaction, cognitive psychology, and design principles informs my research-based methodologies and innovative strategies. I excel in user research, wireframing, prototyping, and usability testing, leading design projects and mentoring junior designers. I am a strong communicator and collaborator, dedicated to continuous learning and professional development, and passionate about mentoring aspiring designers and contributing to the UX community."
183,"As a 27-year-old Junior Product Manager with a Bachelor's degree and two years of experience, I have a solid foundation in product management. I collaborate closely with cross-functional teams, including engineers, designers, and marketers, to bring innovative products to market. My role involves ensuring our products meet customer needs and business goals. I thrive in dynamic environments, leveraging my analytical skills and creativity to solve complex problems. My background in business principles and product development processes supports my daily responsibilities. I am passionate about continuous learning and have successfully contributed to several product launches and improvements, driving user engagement and satisfaction."
184,"I am a 36-year-old Senior Marketing Specialist with a Bachelor's degree and eight years of experience in the marketing field. I specialize in developing and executing strategic marketing campaigns that enhance brand awareness and customer engagement. My expertise includes digital marketing, social media, content creation, and email marketing. I excel in analyzing market trends and leveraging data-driven insights to create impactful strategies. A notable achievement in my career is leading a successful rebranding campaign that significantly boosted brand recognition and customer loyalty. Currently, I manage a team of marketing professionals, ensuring our efforts align with the company's business objectives."
185,"As a Senior IT Project Manager with 14 years of experience, I specialize in managing complex projects and leading cross-functional teams to deliver innovative IT solutions. My Bachelor's degree has provided a strong foundation, allowing me to excel in both technical and managerial aspects of project management. I thrive in dynamic environments, leveraging my expertise to ensure projects are completed on time, within scope, and on budget. Staying updated with the latest technological trends keeps me engaged and motivated, and I continuously seek professional development opportunities to enhance my skills and drive successful project outcomes."
186,"I am a 33-year-old Senior Financial Analyst with a Master's degree in Finance and six years of experience in the financial sector. My expertise lies in conducting comprehensive financial analyses, preparing detailed reports, and advising on investment opportunities. I excel at scrutinizing financial statements, forecasting future performance, and identifying trends that impact financial health. My proficiency with various financial software and tools enhances the accuracy of my analyses. I am committed to continuous learning and professional growth, regularly participating in industry seminars and workshops to stay current with the latest trends in finance."
187,"I am a 34-year-old Senior Quality Assurance Analyst with a Bachelor's degree and nine years of experience in the field. I specialize in ensuring the highest standards of quality for software products through meticulous testing methodologies. My role involves designing and implementing test plans, identifying and documenting defects, and collaborating closely with development teams to resolve issues. I am dedicated to continuous improvement and staying current with industry trends, and I excel in communicating effectively with both technical and non-technical stakeholders to align on quality objectives."
188,"I am a 50-year-old woman with a PhD, currently serving as the Director of Sales and Marketing. With 22 years of experience, I have developed a deep understanding of sales and marketing intricacies. I excel in strategizing, understanding market trends, and driving organizational growth. My role involves creating and implementing comprehensive sales and marketing strategies, leveraging data-driven decision-making, and building strong client relationships. I am passionate about mentoring my team and fostering a collaborative environment. Outside of work, I stay updated with industry trends and enjoy sharing my knowledge through speaking engagements and publications."
189,"As a 28-year-old Junior Operations Analyst with a Bachelor's degree, I bring 1.5 years of experience in analyzing and improving operational processes to enhance efficiency and productivity. My role involves data analysis, process mapping, and identifying areas for improvement. I thrive on problem-solving and developing innovative solutions to complex issues. Despite being relatively new to the professional world, I have gained valuable experience and a keen eye for detail. I am committed to continuous learning and professional development, always seeking opportunities to expand my knowledge and skills to contribute positively to my organization."
190,"I am a 39-year-old Senior Account Executive with a Bachelor's degree and 12 years of experience. In my role, I manage key client accounts, develop strategic plans, and ensure top-tier service delivery. My expertise includes understanding market trends, exceptional communication, and building strong client relationships. I am dedicated to continuous learning and professional development, bringing innovation and creativity to my work. Passionate about my career, I strive to exceed expectations and deliver outstanding results."
191,"I am a 47-year-old male with a Master's degree in Business Administration and 19 years of professional experience. As the Director of Business Development, I specialize in strategic planning, market analysis, and team leadership. My role involves identifying and pursuing new business opportunities, forging strategic partnerships, and enhancing our market presence. My extensive experience has equipped me with a deep understanding of various industries' complexities and dynamics. I am committed to delivering exceptional results, thinking critically, communicating effectively, and inspiring my team to achieve our collective goals. I am passionate about continuous learning and professional development."
192,"I am a 30-year-old female currently working as a Junior Social Media Manager with a Bachelor's degree. With three years of experience, I have a solid foundation in communication, marketing, and digital media strategies. My responsibilities include creating and managing content across various social media platforms, engaging with our audience, and analyzing performance metrics to optimize our strategies. I thrive in dynamic environments where creativity and adaptability are key, and I am always eager to learn about new trends and tools to enhance our online presence."
193,"I am a 34-year-old male with a Bachelor's degree, currently working as a Senior Product Manager. With seven years of experience in the industry, I have honed my skills in product development, project management, and team leadership. Over the years, I have successfully led multiple product launches, collaborated with cross-functional teams, and driven significant growth for the companies I have worked with. My role involves strategizing product roadmaps, analyzing market trends, and ensuring that our products meet customer needs and business goals. I am passionate about innovation and always strive to stay ahead of industry trends."
194,"I am a 40-year-old Senior Human Resources Specialist with a Master's degree and 13 years of experience. My expertise includes talent acquisition, employee relations, performance management, and organizational development. I am dedicated to fostering a positive work environment and helping both employees and organizations thrive. My extensive experience has equipped me with a deep understanding of HR best practices and the ability to navigate complex workplace issues effectively. I am committed to continuing my professional growth while making meaningful contributions to my organization."
195,"I am a 28-year-old Junior Business Analyst with a Bachelor's degree and two years of experience. My expertise lies in data analysis, market research, and strategic planning. In my current role, I analyze business processes, identify areas for improvement, and provide actionable insights to drive company growth. I collaborate with various departments to gather data, interpret trends, and communicate complex information clearly. I am committed to continuous learning and regularly participate in workshops and online courses to stay updated with industry trends and tools. My goal is to advance to a senior analyst position."
196,"As a 41-year-old Senior Marketing Coordinator with a Bachelor's degree and over 11 years of experience, I specialize in overseeing and coordinating marketing campaigns. I manage a team of talented marketers, ensuring our strategies align with company goals. My expertise includes analyzing market trends, developing creative content, and executing successful initiatives to drive brand awareness and customer engagement. I am passionate about staying current with the latest marketing trends and technologies, continuously seeking opportunities to expand my knowledge and expertise. My dedication to excellence has been recognized by my peers and superiors, making a positive impact on the organizations I've worked with."
197,"I am a 45-year-old Senior Data Analyst with a PhD in Data Science and 17 years of experience. My expertise lies in data analysis, statistical modeling, and machine learning. I have worked on diverse projects in finance, healthcare, and technology, collaborating with cross-functional teams to develop predictive models and optimize business processes. I excel at communicating complex technical concepts to non-technical stakeholders, ensuring data-driven decisions are accessible. My commitment to continuous learning and staying updated with industry trends allows me to deliver valuable insights and drive innovation."
198,"I am a 32-year-old female currently working as a Junior Account Manager with a Bachelor's degree. Over the past five years, I have gained valuable experience in account management, focusing on client relations, project coordination, and strategic planning. In my role, I manage client accounts, ensuring their needs are met and helping them achieve their business goals. I excel at building strong relationships with clients, understanding their unique requirements, and delivering tailored solutions. My job allows me to collaborate with various teams, enhancing my communication and teamwork abilities. I am passionate about my work and eager to learn new strategies to improve my performance."
199,"I am a 35-year-old male with a Master's degree in Computer Science, currently working as a Senior Software Developer. With nine years of experience, I specialize in full-stack development and am proficient in various programming languages and frameworks. My expertise includes developing complex algorithms and designing user-friendly applications. I write clean, efficient code and enjoy collaborating with cross-functional teams to deliver innovative solutions. Additionally, I mentor junior developers, conduct code reviews, and stay updated with industry trends. In my free time, I contribute to open-source projects and explore new technologies to continuously enhance my skills."
200,"I am a 49-year-old female with a Master's degree, currently serving as the Director of Human Capital. With 21 years of experience in human resources and organizational development, I oversee the strategic management of human capital. My responsibilities include ensuring team support, fostering a positive workplace culture, and driving organizational success through effective human capital management. I am passionate about helping individuals grow and thrive in their careers."
201,"I am a 30-year-old male working as a Junior Advertising Coordinator with a Bachelor's degree. With three years of experience in the advertising industry, I specialize in campaign management, client relations, and creative strategy. My role involves assisting in the development and execution of advertising campaigns, coordinating with creative, media, and production departments to ensure timely and budget-friendly delivery. I work closely with clients to understand their needs and create engaging advertisements that resonate with their target audience. I am passionate about the industry and continuously seek opportunities to learn and grow."
202,"As a 44-year-old Senior Sales Manager with a Bachelor's degree and 16 years of experience in the sales industry, I have developed a deep understanding of market dynamics, customer needs, and effective sales strategies. My expertise includes leadership, negotiation, and relationship-building, which have been instrumental in driving revenue growth and achieving company targets. I oversee a talented team of sales professionals, setting sales goals, developing strategic plans, and analyzing market trends to identify new opportunities. I am passionate about mentoring my team and fostering a collaborative environment where everyone can thrive."
203,"I am a 27-year-old female working as a Junior UX Designer with a Master's degree. With 1.5 years of professional experience, I specialize in creating intuitive and engaging user interfaces. My work focuses on understanding user needs and behaviors to design functional and aesthetically pleasing solutions. I am passionate about continuous learning and staying updated with the latest trends and technologies in UX design, which I believe are essential for success in this dynamic field."
204,"I am a 36-year-old Senior Accountant with a Bachelor's degree in Accounting and seven years of experience. In my role, I manage and oversee financial activities, prepare financial statements, conduct audits, and ensure compliance with regulations. I am also involved in budgeting and forecasting to aid in informed decision-making. My expertise in various accounting software has streamlined operations and enhanced efficiency. I am committed to continuous improvement and staying updated with industry trends. Known for my strong work ethic and reliability, I excel in handling complex tasks and strive to foster a positive work environment."
