id,Description
0,"I am a 32-year-old male working as a Software Engineer with a Bachelor's degree in Computer Science. With five years of experience, I specialize in designing, developing, and maintaining software applications. My expertise includes programming languages such as Python, Java, and C++, and I am proficient in Agile and DevOps methodologies. I have worked on diverse projects, from web applications to backend systems, and take pride in writing clean, maintainable code. I thrive in collaborative team environments and am committed to continuous learning and professional growth."
1,"I am a 28-year-old data analyst with a Master's degree and three years of experience in the field. My role involves collecting, processing, and analyzing large datasets to support informed decision-making within my organization. I excel at uncovering hidden patterns and insights, and I present my findings clearly and actionably. I collaborate with various departments, continuously learning and contributing to the company's success. I am committed to staying updated with the latest trends and technologies in data analytics through continuous professional development."
2,"I am a 45-year-old Senior Manager with a PhD and 15 years of extensive experience in my field. My advanced education has equipped me with deep industry knowledge and research capabilities. In my role, I oversee projects, mentor junior staff, and ensure strategic goals are met. I excel in navigating complex challenges and delivering exceptional results. Committed to continuous learning, I stay updated with the latest industry trends to maintain a competitive edge. My passion for excellence and drive to achieve have been key factors in my professional growth and success."
3,"I am a 36-year-old female Sales Associate with a Bachelor's degree and seven years of experience in the field. My expertise lies in customer service, sales techniques, and product knowledge, which have been instrumental in my success. I excel in connecting with customers, understanding their needs, and providing tailored solutions. My commitment to continuous improvement and staying updated with industry trends drives my professional growth. I am dedicated to exceeding expectations and contributing to the success of my team and organization."
4,"I am a 52-year-old male with over two decades of experience in my field, currently serving as a Director. Holding a Master's degree, I have developed a deep understanding of the industry, enabling me to lead teams effectively and make strategic decisions. My role involves overseeing various aspects of the organization, from strategic planning to operational execution, and collaborating with different departments to ensure our objectives are met. I take pride in mentoring my team and fostering an environment of collaboration and innovation, continuously striving to drive organizational success."
5,"I am a 29-year-old Marketing Analyst with a Bachelor's degree and two years of experience in the marketing field. My expertise includes market research, data analysis, and strategic planning. I analyze market trends, identify target audiences, and develop marketing strategies to help achieve business goals. I am passionate about understanding consumer behavior and using data-driven insights to create effective marketing campaigns. My analytical mindset and attention to detail enable me to interpret complex data and translate it into actionable recommendations. I enjoy collaborating with cross-functional teams to drive brand awareness and customer engagement."
6,"I am a 42-year-old female with a Master's degree, currently working as a Product Manager with 12 years of experience. I have a deep understanding of product development, market analysis, and strategic planning, which has enabled me to lead successful projects and drive business growth. My skills include managing cross-functional teams, collaborating with stakeholders, and delivering high-quality products that meet customer needs. I excel in balancing technical knowledge with creative problem-solving and am committed to continuous learning and professional development."
7,"I am a 31-year-old Sales Manager with a Bachelor's degree and four years of experience in the field. My role involves leading a team of sales professionals, setting targets, and developing strategies to achieve our goals. I thrive in dynamic environments where I can leverage my analytical skills and creativity to drive results. My responsibilities include being both a leader and a mentor, helping my team members grow and succeed. My education has provided me with a strong foundation in business principles, which I continuously build upon through hands-on experience and ongoing professional development."
8,"I am a 26-year-old female Marketing Coordinator with a Bachelor's degree and one year of professional experience. In my role, I assist in developing and executing marketing campaigns, conduct market research, and analyze data to measure strategy effectiveness. I collaborate with various teams to ensure our marketing efforts align with company goals. My job allows me to be creative, strategic, and detail-oriented. I am passionate about marketing, eager to learn, and constantly seeking opportunities to expand my skill set through training, certifications, and hands-on experience. My goal is to advance within the marketing field and eventually move into a leadership position."
9,"I am a 38-year-old Senior Scientist with a PhD and a decade of experience in scientific research and innovation. My career has involved leading research initiatives, mentoring junior scientists, and developing cutting-edge technologies. I have collaborated on a variety of groundbreaking projects, contributing to significant advancements in the field. My passion for discovery drives me to stay at the forefront of scientific developments, and I am dedicated to continuous learning and professional growth."
10,"I am a 29-year-old male Software Developer with a Master's degree in Computer Science and three years of professional experience. My expertise includes developing efficient and innovative software solutions, working on diverse projects such as web applications and complex backend systems. I am proficient in Java, Python, and JavaScript, and I thrive in collaborative environments. I am dedicated to continuous learning, regularly participating in online courses, industry conferences, and community meetups. In my free time, I enjoy exploring new technologies and working on personal projects to expand my knowledge and skills."
11,"I am a 48-year-old HR Manager with a Bachelor's degree and 18 years of extensive experience in human resources. My expertise includes talent acquisition, employee relations, and organizational development. I excel in creating inclusive and productive workplaces, navigating complex employee issues with empathy and professionalism. My role involves overseeing recruitment processes, developing training programs, and implementing performance management systems. I am committed to continuous learning and staying updated with the latest HR trends and technologies, which enables me to introduce innovative solutions that enhance employee engagement and drive organizational performance."
12,"I am a 35-year-old Financial Analyst with a Bachelor's degree in Finance and six years of experience in the financial industry. My expertise lies in financial planning, analysis, and reporting. In my current role, I analyze financial data, prepare reports, and provide insights to guide strategic decision-making. I excel in interpreting complex financial information and presenting it clearly and actionable. My strong analytical skills, attention to detail, and ability to work under pressure have been crucial to my success. I am passionate about staying current with industry trends and continuously improving my skills to provide top-notch financial advice and support."
13,"I am a 40-year-old female with a Master's degree, currently working as a Project Manager with 14 years of experience. My expertise lies in project planning, execution, and team leadership, enabling me to deliver projects on time and within budget. My strong educational background and strategic mindset help me navigate complex projects effectively. I am passionate about continuous learning and staying updated with industry trends. I excel in leading cross-functional teams, fostering collaboration, and aligning stakeholders with project goals. My communication and problem-solving skills are key to overcoming challenges and achieving project milestones."
14,"I am a 27-year-old male working as a Customer Service Representative with a Bachelor's degree. With two years of experience, I excel in communication, problem-solving, and customer relations. My role involves handling customer interactions via phone, email, and live chat, where I focus on resolving issues efficiently and ensuring a positive customer experience. I am dedicated to continuous learning and professional growth, always seeking to enhance my skills and advance in my career."
15,"I am a 44-year-old male with a Bachelor's degree and 16 years of experience as an Operations Manager. My expertise lies in managing and optimizing operational processes to ensure efficiency and productivity. I oversee daily operations, streamline processes, and implement strategies to enhance performance. I thrive on making a tangible impact by identifying areas for improvement and implementing effective solutions. Strong leadership and effective communication are key aspects of my role, fostering a collaborative and motivated team environment. I am committed to staying updated with industry trends to bring the most value to my organization."
16,"I am a 33-year-old Marketing Manager with a Master's degree and seven years of experience in the marketing field. I specialize in developing and executing strategic marketing plans that drive brand awareness and revenue growth. My expertise includes understanding consumer behavior and leveraging data-driven insights to create compelling campaigns. I oversee a talented team, manage budgets, and collaborate with cross-functional departments to align marketing efforts with company goals. I am committed to continuous learning and staying updated with the latest marketing trends and technologies to navigate the ever-evolving marketing landscape successfully."
17,"I am a 39-year-old Senior Engineer with a PhD and 12 years of experience. My expertise lies in understanding complex systems and developing innovative solutions. I am dedicated to continuous learning and professional growth, leveraging my advanced knowledge and research capabilities to tackle intricate problems. I excel in leading teams, mentoring junior engineers, and driving successful project outcomes. My career has taught me the importance of collaboration, effective communication, and adaptability in the ever-evolving engineering industry. I am passionate about engineering and committed to delivering high-quality work while staying at the forefront of technological advancements."
18,"I am a 25-year-old female currently working as a Data Entry Clerk. I hold a Bachelor's degree, which has provided me with a strong foundation in various subjects and enhanced my analytical and organizational skills. In my role, I am responsible for accurately inputting and managing data, ensuring all information is up-to-date and correctly entered into our systems. My attention to detail and ability to work efficiently under tight deadlines are key strengths. I am eager to learn and grow in my role, particularly in data management and analysis, and I am committed to continuous learning and self-improvement."
19,"I am a 51-year-old Sales Director with over 22 years of experience in the field. I hold a Bachelor's degree, which has provided me with a strong foundation in business principles and sales strategies. Throughout my career, I have honed my skills in leadership, team management, and strategic planning, allowing me to drive significant revenue growth and achieve company objectives consistently. In my current role, I oversee a talented sales team, guiding them to meet and exceed targets through effective coaching, motivation, and performance management. My extensive experience includes analyzing market trends, identifying new business opportunities, and developing comprehensive sales plans."
20,"I am a 34-year-old Business Analyst with a Master's degree and five years of experience. I excel in analyzing business processes, identifying areas for improvement, and implementing effective solutions. My role involves gathering and interpreting data, conducting market research, and collaborating with stakeholders to understand their needs. I communicate complex information clearly and ensure alignment throughout the project lifecycle. I am dedicated to delivering high-quality work and continuously stay updated with industry trends and best practices to bring innovative insights to my team."
21,"I am a 47-year-old male with a Master's degree, currently serving as the Vice President of Operations. With 19 years of experience, I have honed my skills to effectively oversee and optimize operational processes within the organization. My role involves strategic planning, resource management, and ensuring that our operations align with the company's goals and objectives. I am committed to driving efficiency, fostering innovation, and leading my team towards achieving excellence in every project we undertake."
22,"As an IT Support Specialist with a Bachelor's degree and two years of experience, I excel in troubleshooting technical issues, providing excellent customer service, and ensuring smooth IT operations. My responsibilities include diagnosing and resolving hardware and software problems, setting up and maintaining computer systems, and assisting employees with their technical needs. I pride myself on effectively communicating complex technical information to non-technical users, minimizing downtime, and keeping our team productive. My passion for technology and problem-solving drives me to stay updated with industry trends and continuously improve my skills to better serve my colleagues and contribute to the company's success."
23,"I am a 36-year-old professional working as a Recruiter with a Bachelor's degree and nine years of experience in the field. My expertise lies in identifying and attracting top talent, conducting interviews, and managing the hiring process from start to finish. I have a keen eye for recognizing potential in candidates and matching them with roles that align with their skills and career aspirations. My experience spans various industries, allowing me to adapt to different organizational cultures and hiring needs. I am passionate about helping companies grow by bringing in the right people and helping individuals find fulfilling career opportunities."
24,"I am a 41-year-old male with a Master's degree in Finance, currently serving as a Financial Manager with 13 years of experience. My expertise lies in financial planning, analysis, and strategy, which enables me to manage and optimize the financial health of organizations. I oversee financial operations, develop budgets, forecast financial performance, and ensure compliance with financial regulations. My strategic mindset and attention to detail allow me to navigate complex financial landscapes and provide valuable insights that drive business growth and efficiency. I am committed to continuous learning and professional development to stay current with industry trends."
25,"I am a 28-year-old Social Media Specialist with a Bachelor's degree and three years of experience in the field. My role involves creating, curating, and managing content across various social media platforms. I develop strategies to increase brand awareness, engage with our audience, and drive website traffic. I stay updated with the latest social media trends and best practices, ensuring our company remains competitive. I am passionate about storytelling, combining creativity with analytical skills to craft compelling, data-driven content. I regularly analyze performance metrics to optimize campaigns and achieve marketing goals."
26,"I am a 37-year-old female with a Master's degree in Computer Science, currently working as a Software Manager. With 11 years of experience in the tech industry, I have developed a deep understanding of software development, project management, and team leadership. I lead a talented team of developers through the software development lifecycle, fostering a collaborative and innovative work environment. My responsibilities include strategic planning, resource allocation, and ensuring timely project delivery. I am passionate about leveraging technology to solve complex problems and improve user experiences, always seeking ways to optimize processes and enhance efficiency."
27,"I am a 24-year-old Junior Developer with a Bachelor's degree in computer science. With one year of professional experience, I have worked on various projects that have honed my coding skills and problem-solving abilities. I thrive on the challenges of debugging and optimizing code to create efficient software solutions. Passionate about technology, I am eager to continue learning and contributing to my team's success in the ever-evolving tech industry."
28,"I am a 43-year-old Senior Consultant with a PhD and 15 years of experience in my field. My expertise lies in providing strategic advice, developing innovative solutions, and guiding clients through complex challenges. My role involves analyzing intricate problems, designing effective strategies, and delivering results that exceed expectations. My PhD has equipped me with specialized knowledge and honed my analytical and critical thinking skills, which are invaluable in my consulting work. Additionally, I am passionate about mentoring junior colleagues and fostering a collaborative work environment. Continuous learning and staying updated with industry trends are essential to me."
29,"I am a 33-year-old male with a Master's degree in Design, currently working as a Product Designer with six years of experience. My expertise includes user research, prototyping, and usability testing. I collaborate with cross-functional teams to develop products that align with business goals and provide exceptional user experiences. I am committed to staying updated with the latest design trends and technologies to continuously enhance my skills and create innovative, intuitive products that positively impact users' lives."
30,"I am a 50-year-old male with a Bachelor's degree and 25 years of experience in the business world. Currently, I serve as the CEO of my company. My career has been defined by developing leadership skills, strategic thinking, and driving growth and innovation. In my role, I set the strategic direction, oversee operations, and ensure financial goals are met. I am committed to continuous learning and personal development, staying updated with industry trends to adapt to the ever-changing business landscape. I believe in leading by example and fostering a positive and productive work environment."
31,"I am a 31-year-old female accountant with a Bachelor's degree and four years of experience in the accounting field. I have a solid foundation in financial management, budgeting, and auditing. In my current role, I analyze financial statements, prepare tax returns, and ensure compliance with financial regulations. I am passionate about numbers and enjoy solving complex financial problems. My attention to detail and strong analytical skills are key to my success. Additionally, I am a strong communicator and team player, collaborating with colleagues to provide financial insights and support strategic decision-making."
32,"I am a 29-year-old Data Scientist with a Master's degree and three years of experience in data analysis, machine learning, and statistical modeling. My role involves designing and implementing algorithms to analyze large datasets, creating predictive models, and visualizing data to support informed decision-making. I collaborate with cross-functional teams to align data-driven strategies with organizational goals. My expertise spans customer segmentation, recommendation systems, A/B testing, and natural language processing. I am passionate about leveraging data to drive innovation and improve processes, and I continuously seek to expand my knowledge through online courses, industry conferences, and community engagement."
33,"I am a 39-year-old Marketing Specialist with a Bachelor's degree and 10 years of experience in the field. My expertise spans digital marketing campaigns, social media management, market research, and brand development. I excel at crafting innovative, data-driven strategies that connect with target audiences. My role requires a blend of creativity and analytical thinking, and I stay updated with the latest marketing trends and technologies. I am passionate about creating compelling content and campaigns, and I am always eager to take on new challenges and opportunities to grow in the dynamic world of marketing."
34,"As a 46-year-old Senior Manager with a PhD and 20 years of experience, I have developed strong analytical and strategic thinking abilities. My role involves overseeing operations, meeting targets, and mentoring future leaders. I excel in fostering a collaborative and innovative work environment. My extensive experience has given me a deep understanding of market trends, risk management, and strategic planning, enabling me to make informed decisions that align with company goals. I stay updated with industry developments and enjoy networking to bring fresh ideas to my team."
35,"I am a 27-year-old Technical Writer with a Bachelor's degree and 2 years of experience. My expertise lies in creating clear, concise, and user-friendly documentation for various technical products and services. I specialize in translating complex technical information into easily understandable content, including manuals, user guides, and online help systems. My strong understanding of technical concepts and effective communication skills are key assets in my role. I am passionate about continuous learning and professional growth, always seeking opportunities to improve my writing and expand my expertise in technical communication."
36,"As a 35-year-old HR Generalist with a Bachelor's degree and seven years of experience, I have a solid foundation in various HR functions, including recruitment, employee relations, benefits administration, and labor law compliance. My role involves engaging with employees at all levels, providing support and guidance to foster a positive work environment. I am passionate about promoting inclusivity and continuous improvement, leveraging effective communication, empathy, and problem-solving skills. Dedicated to professional growth, I stay current with industry trends and advancements to implement best practices and innovative HR strategies."
37,"I am a 42-year-old male with a Master's degree, currently working as a Project Engineer. With 14 years of experience in the field, I have honed my skills and expertise to effectively manage and execute engineering projects. My extensive background includes overseeing complex projects from inception to completion, ensuring they meet both technical specifications and budgetary constraints. Throughout my career, I have developed a keen eye for detail and a strong ability to solve problems efficiently. My role often requires me to collaborate with cross-functional teams, leveraging my communication and leadership skills to drive projects forward."
38,"I am a 26-year-old female with a Bachelor's degree, currently working as a Customer Success Representative. With one year of experience, I am dedicated to helping customers achieve their goals and ensuring a positive experience with our products and services. My role involves engaging with clients, understanding their needs, and providing tailored solutions to enhance their satisfaction. I thrive in dynamic environments, leveraging my problem-solving abilities and interpersonal skills to build strong customer relationships. My educational background provides a solid foundation, and I am committed to continuous learning and professional development to excel in the field of customer success."
39,"I am a 49-year-old Sales Executive with over 21 years of experience in the field. I hold a Bachelor's degree, which has provided me with a solid foundation in business principles and sales strategies. Throughout my career, I have honed my skills in building and maintaining client relationships, negotiating contracts, and driving revenue growth. My ability to analyze market trends and identify new business opportunities has consistently contributed to my success. In my current role, I manage a diverse portfolio of clients, develop strategic sales plans, and lead a team of sales professionals."
40,"I am a 34-year-old female UX Designer with a Master's degree and five years of experience. My expertise lies in creating user-friendly and aesthetically pleasing interfaces that enhance user experience. I have a solid foundation in design principles, research methodologies, and user psychology, which I apply to every project. My experience spans startups to established companies, involving all stages of the design process from research and wireframing to prototyping and user testing. I am passionate about understanding user needs and translating them into intuitive design solutions, and I thrive in collaborative, cross-functional team environments."
